<?xml version="1.0" encoding="UTF-8" standalone="no"?>
<!DOCTYPE crkva SYSTEM "./gramatika.dtd">
<crkva kategorija="katolicka" aktivnosti="Ministriranje">
    <naziv>Zagrebačka katedrala</naziv>
    <zupnik>
        <ime>Ivan</ime>
        <prezime>Ivanić</prezime>
        <telefon tip="mobilni" br_mreze="099">9998989</telefon>
    </zupnik>
    <zu:zupni_ured xmlns:zu="http://hrvatske-crkve/zupni_ured">
        <zu:mail>tiskovni@zg-nadbiskupija.hr</zu:mail>
        <zu:telefon tip="fiksni" br_mreze="0">14894878</zu:telefon>
    </zu:zupni_ured>
    <adresa>
        <mjesto pos_broj="10000">Zagreb</mjesto>
        <ulica kuc_broj="31">Kaptol</ulica>
    </adresa>
    <misa ispovijed="Prije Poslije">
        <datum>2019-04-07</datum>
        <vrijeme>08:00</vrijeme>
    </misa>
    <misa ispovijed="Prije Poslije">
        <datum>2019-04-14</datum>
        <vrijeme>18:00</vrijeme>
    </misa>
    <misa ispovijed="Prije Poslije">
        <datum>2019-04-21</datum>
        <vrijeme>11:00</vrijeme>
    </misa>
    <god_osnutka>1094</god_osnutka>
    <max_kapacitet>1500</max_kapacitet>
    <zbor>
        <naziv>Slavuji Katedrale Zagreb</naziv>
    </zbor>
</crkva>

<crkva kategorija="katolicka" aktivnosti="Zaruke Caritas">
    <naziv>Dubrovačka katedrala</naziv>
    <zupnik>
        <ime>Vlaho</ime>
        <prezime>Katušić</prezime>
        <telefon tip="mobilni" br_mreze="091">8798529</telefon>
    </zupnik>
    <zu:zupni_ured xmlns:zu="http://hrvatske-crkve/zupni_ured">
        <zu:mail>dubrovnik.katedrala@info.hr</zu:mail>
        <zu:telefon tip="fiksni" br_mreze="0">20312011</zu:telefon>
    </zu:zupni_ured>
    <adresa>
        <mjesto pos_broj="20000">Dubrovnik</mjesto>
        <ulica kuc_broj="5">Brsalje</ulica>
    </adresa>
        <misa ispovijed="Prije">
        <datum>2019-05-07</datum>
        <vrijeme>08:00</vrijeme>
    </misa>
    <misa ispovijed="Prije">
        <datum>2019-05-14</datum>
        <vrijeme>18:00</vrijeme>
    </misa>
    <misa ispovijed="Prije">
        <datum>2019-05-21</datum>
        <vrijeme>11:00</vrijeme>
    </misa>

    <god_osnutka>1713</god_osnutka>
    <max_kapacitet>500</max_kapacitet>
    <zbor>
        <naziv>Zbor sv. Vlaha</naziv>
    </zbor>
</crkva>

<crkva kategorija="katolicka" aktivnost="Caritas Zaruke Ministriranje">
    <naziv>Katedrala Svetog Vida</naziv>
    <zupnik>
        <ime>Mihovil</ime>
        <prezime>Radić</prezime>
        <telefon tip="mobilni" br_mreze="092">14568875</telefon>
    </zupnik>
    <zu:zupni_ured xmlns:zu="http://hrvatske-crkve/zupni_ured">
        <zu:mail>zupa-vido@email.t-com.hr</zu:mail>
    </zu:zupni_ured>
    <adresa>
        <mjesto pos_broj="51000">Rijeka</mjesto>
        <ulica kuc_broj="2">Trg Svete Barbare</ulica>
    </adresa>
    <misa>
        <datum>2019-05-07</datum>
        <vrijeme>08:00</vrijeme>
    </misa>
    <misa ispovijed="Prije Poslije">
        <datum>2019-04-22</datum>
        <vrijeme>19:00</vrijeme>
    </misa>
    <misa ispovijed="Prije Poslije">
        <datum>2019-05-21</datum>
        <vrijeme>11:00</vrijeme>
    </misa>
    <god_osnutka>1638</god_osnutka>
    <max_kapacitet>300</max_kapacitet>
    <zbor>
        <naziv>Vidova Dica</naziv>
        <broj>27</broj>
    </zbor>
</crkva>

<crkva kategorija="pravoslavna">
   <naziv>Preobraženja gospodnjeg</naziv>
    <zupnik>
        <ime>Bogdan</ime>
        <prezime>Malik</prezime>
        <telefon tip="mobilni" br_mreze="098">9479100</telefon>
    </zupnik>
    <zu:zupni_ured xmlns:zu="http://hrvatske-crkve/zupni_ured">
        <zu:telefon tip="fiksni" br_mreze="0">14614132</zu:telefon>
    </zu:zupni_ured>
    <adresa>
        <mjesto pos_broj="10000">Zagreb</mjesto>
    </adresa>
     <misa>
        <datum>2019-05-07</datum>
        <vrijeme>06:00</vrijeme>
    </misa>
    <misa>
        <datum>2019-04-22</datum>
        <vrijeme>17:00</vrijeme>
    </misa>
    <misa>
        <datum>2019-08-21</datum>
        <vrijeme>10:00</vrijeme>
    </misa>
    <god_osnutka>1866</god_osnutka>
    <max_kapacitet>100</max_kapacitet>
</crkva>

<crkva kategorija="katolicka" aktivnosti="Vjeronauk">
    <naziv>Crkva Gospe od Betlema</naziv>
    <zupnik>
        <ime>Marko</ime>
        <prezime>Šoltarić</prezime>
        <telefon tip="mobilni" br_mreze="098">8571289</telefon>
    </zupnik>
    <zu:zupni_ured xmlns:zu="http://hrvatske-crkve/zupni_ured">
        <zu:mail>zupni-ured@sveti-petar.hr</zu:mail>
        <zu:telefon tip="fiksni" br_mreze="0">14633534</zu:telefon>
    </zu:zupni_ured>
    <adresa>
        <mjesto pos_broj="21000">Split</mjesto>
        <ulica kuc_broj="3">Marangunićevo šetalište</ulica>
    </adresa>
    <misa ispovijed="Poslije">
        <datum>2019-07-12</datum>
        <vrijeme>08:00</vrijeme>
    </misa>
    <misa ispovijed="Poslije">
        <datum>2019-07-02</datum>
        <vrijeme>19:00</vrijeme>
    </misa>
    <misa ispovijed="Poslije">
        <datum>2019-04-21</datum>
        <vrijeme>18:00</vrijeme>
    </misa>
    <god_osnutka>1500</god_osnutka>
</crkva>